user_id,type,abstract_title,abstract,human_written,abstract_id
1,interactive,Exercise for type 2 diabetes mellitus,"Exercise is generally recommended for people with type 2 diabetes mellitus. However, some studies evaluate an exercise intervention including diet or behaviour modification or both, and the effects of diet and exercise are not differentiated. Some exercise studies involve low participant numbers, lacking power to show significant differences which may appear in larger trials.
To assess the effects of exercise in type 2 diabetes mellitus.
Trials were identified through the Cochrane Central Register of Controlled Trials (CENTRAL), MEDLINE, EMBASE and manual searches of bibliographies.
All randomised controlled trials comparing any type of well-documented aerobic, fitness or progressive resistance training exercise with no exercise in people with type 2 diabetes mellitus.
Two authors independently selected trials, assessed trial quality and extracted data. Study authors were contacted for additional information. Any information on adverse effects was collected from the trials.
Fourteen randomised controlled trials comparing exercise against no exercise in type 2 diabetes were identified involving 377 participants. Trials ranged from eight weeks to twelve months duration. Compared with the control, the exercise intervention significantly improved glycaemic control as indicated by a decrease in glycated haemoglobin levels of 0.6% (-0.6 % HbA1c, 95% confidence interval (CI) -0.9 to -0.3; P < 0.05). This result is both statistically and clinically significant. There was no significant difference between groups in whole body mass, probably due to an increase in fat free mass (muscle) with exercise, as reported in one trial (6.3 kg, 95% CI 0.0 to 12.6). There was a reduction in visceral adipose tissue with exercise (-45.5 cm2, 95% CI -63.8 to -27.3), and subcutaneous adipose tissue also decreased. No study reported adverse effects in the exercise group or diabetic complications. The exercise intervention significantly increased insulin response (131 AUC, 95% CI 20 to 242) (one trial), and decreased plasma triglycerides (-0.25 mmol/L, 95% CI -0.48 to -0.02). No significant difference was found between groups in quality of life (one trial), plasma cholesterol or blood pressure.
The meta-analysis shows that exercise significantly improves glycaemic control and reduces visceral adipose tissue and plasma triglycerides, but not plasma cholesterol, in people with type 2 diabetes, even without weight loss.","Exercise, dietary changes and medications are frequently used in the management of type 2 diabetes. However, it is difficult to determine the independent effect of exercise from some trials because exercise has been combined with dietary modifications or medications, or compared with a control which includes another form of intervention. The review authors aimed to determine the effect of exercise on blood sugar control in type 2 diabetes. This review found that exercise improves blood sugar control and that this effect is evident even without weight loss. Furthermore, exercise decreases body fat content, thus the failure to lose weight with exercise programmes is probably explained by the conversion of fat to muscle. Exercise improved the body's reaction to insulin and decreased blood lipids. Quality of life was only assessed in one study, which found no difference between the two groups. No significant difference was found between groups in blood levels of cholesterol or blood pressure. A total of 14 randomised controlled trials were assessed. These included 377 participants and compared groups that differed only with respect to an exercise programme intervention. The duration of the interventions in the studies ranged from eight weeks to one year. Two studies reported follow-up information, one at six months after the end of the six month exercise intervention and one at twelve months post-intervention. Generally, the studies were well-conducted, but blinding of outcome assessors was not reported and although all studies reported that randomisation was performed, few gave details of the method.No adverse effects with exercise were reported. The effect of exercise on diabetic complications was not assessed in any of the studies. The relatively short duration of trials prevented the reporting of any significant long term complications or mortality. Another limitation was the small number of participants included in the analyses for adiposity, blood pressure, cholesterol, body's muscle and quality of life.",1001
1,interactive,Is metformin an effective treatment for adults with type 2 diabetes?,"Worldwide, there is an increasing incidence of type 2 diabetes mellitus (T2DM). Metformin is still the recommended first-line glucose-lowering drug for people with T2DM. Despite this, the effects of metformin on patient-important outcomes are still not clarified.
To assess the effects of metformin monotherapy in adults with T2DM.
We based our search on a systematic report from the Agency for Healthcare Research and Quality, and topped-up the search in CENTRAL, MEDLINE, Embase, WHO ICTRP, and ClinicalTrials.gov. Additionally, we searched the reference lists of included trials and systematic reviews, as well as health technology assessment reports and medical agencies. The date of the last search for all databases was 2 December 2019, except Embase (searched up 28 April 2017).
We included randomised controlled trials (RCTs) with at least one year's duration comparing metformin monotherapy with no intervention, behaviour changing interventions or other glucose-lowering drugs in adults with T2DM.
Two review authors read all abstracts and full-text articles/records, assessed risk of bias, and extracted outcome data independently. We resolved discrepancies by involvement of a third review author. For meta-analyses we used a random-effects model with investigation of risk ratios (RRs) for dichotomous outcomes and mean differences (MDs) for continuous outcomes, using 95% confidence intervals (CIs) for effect estimates. We assessed the overall certainty of the evidence by using the GRADE instrument.
We included 18 RCTs with multiple study arms (N = 10,680). The percentage of participants finishing the trials was approximately 58% in all groups. Treatment duration ranged from one to 10.7 years. We judged no trials to be at low risk of bias on all 'Risk of bias' domains. The main outcomes of interest were all-cause mortality, serious adverse events (SAEs), health-related quality of life (HRQoL), cardiovascular mortality (CVM), non-fatal myocardial infarction (NFMI), non-fatal stroke (NFS), and end-stage renal disease (ESRD). Two trials compared metformin (N = 370) with insulin (N = 454). Neither trial reported on all-cause mortality, SAE, CVM, NFMI, NFS or ESRD. One trial provided information on HRQoL but did not show a substantial difference between the interventions. Seven trials compared metformin with sulphonylureas. Four trials reported on all-cause mortality: in three trials no participant died, and in the remaining trial 31/1454 participants (2.1%) in the metformin group died compared with 31/1441 participants (2.2%) in the sulphonylurea group (very low-certainty evidence). Three trials reported on SAE: in two trials no SAE occurred (186 participants); in the other trial 331/1454 participants (22.8%) in the metformin group experienced a SAE compared with 308/1441 participants (21.4%) in the sulphonylurea group (very low-certainty evidence). Two trials reported on CVM: in one trial no CVM was observed and in the other trial 4/1441 participants (0.3%) in the metformin group died of cardiovascular reasons compared with 8/1447 participants (0.6%) in the sulphonylurea group (very low-certainty evidence). Three trials reported on NFMI: in two trials no NFMI occurred, and in the other trial 21/1454 participants (1.4%) in the metformin group experienced a NFMI compared with 15/1441 participants (1.0%) in the sulphonylurea group (very low-certainty evidence). One trial reported no NFS occurred (very low-certainty evidence). No trial reported on HRQoL or ESRD. Seven trials compared metformin with thiazolidinediones (very low-certainty evidence for all outcomes). Five trials reported on all-cause mortality: in two trials no participant died; the overall RR was 0.88, 95% CI 0.55 to 1.39; P = 0.57; 5 trials; 4402 participants). Four trials reported on SAE, the RR was 0,95, 95% CI 0.84 to 1.09; P = 0.49; 3208 participants. Four trials reported on CVM, the RR was 0.71, 95% CI 0.21 to 2.39; P = 0.58; 3211 participants. Three trial reported on NFMI: in two trials no NFMI occurred and in one trial 21/1454 participants (1.4%) in the metformin group experienced a NFMI compared with 25/1456 participants (1.7%) in the thiazolidinedione group. One trial reported no NFS occurred. No trial reported on HRQoL or ESRD. Three trials compared metformin with dipeptidyl peptidase-4 inhibitors (one trial each with saxagliptin, sitagliptin, vildagliptin with altogether 1977 participants). There was no substantial difference between the interventions for all-cause mortality, SAE, CVM, NFMI and NFS (very low-certainty evidence for all outcomes). One trial compared metformin with a glucagon-like peptide-1 analogue (very low-certainty evidence for all reported outcomes). There was no substantial difference between the interventions for all-cause mortality, CVM, NFMI and NFS. One or more SAEs were reported in 16/268 (6.0%) of the participants allocated to metformin compared with 35/539 (6.5%) of the participants allocated to a glucagon-like peptide-1 analogue. HRQoL or ESRD were not reported. One trial compared metformin with meglitinide and two trials compared metformin with no intervention. No deaths or SAEs occurred (very low-certainty evidence)no other patient-important outcomes were reported. No trial compared metformin with placebo or a behaviour changing interventions. Four ongoing trials with 5824 participants are likely to report one or more of our outcomes of interest and are estimated to be completed between 2018 and 2024. Furthermore, 24 trials with 2369 participants are awaiting assessment.
There is no clear evidence whether metformin monotherapy compared with no intervention, behaviour changing interventions or other glucose-lowering drugs influences patient-important outcomes.","Exercise, dietary changes and medications are frequently used in the management of type 2 diabetes. However, it is difficult to determine the independent effect of exercise from some trials because exercise has been combined with dietary modifications or medications, or compared with a control which includes another form of intervention. The review authors aimed to determine the effect of exercise on blood sugar control in type 2 diabetes. This review found that exercise improves blood sugar control and that this effect is evident even without weight loss. Furthermore, exercise decreases body fat content, thus the failure to lose weight with exercise programmes is probably explained by the conversion of fat to muscle. Exercise improved the body's reaction to insulin and decreased blood lipids. Quality of life was only assessed in one study, which found no difference between the two groups. No significant difference was found between groups in blood levels of cholesterol or blood pressure. A total of 14 randomised controlled trials were assessed. These included 377 participants and compared groups that differed only with respect to an exercise programme intervention. The duration of the interventions in the studies ranged from eight weeks to one year. Two studies reported follow-up information, one at six months after the end of the six month exercise intervention and one at twelve months post-intervention. Generally, the studies were well-conducted, but blinding of outcome assessors was not reported and although all studies reported that randomisation was performed, few gave details of the method.No adverse effects with exercise were reported. The effect of exercise on diabetic complications was not assessed in any of the studies. The relatively short duration of trials prevented the reporting of any significant long term complications or mortality. Another limitation was the small number of participants included in the analyses for adiposity, blood pressure, cholesterol, body's muscle and quality of life.",1002
1,interactive,Biosimilar monoclonal antibodies for cancer treatment in adults,"Bone is the most common site of metastatic disease associated with breast cancer (BC). Bisphosphonates inhibit osteoclast-mediated bone resorption, and novel targeted therapies such as denosumab inhibit other key bone metabolism pathways. We have studied these agents in both early breast cancer and advanced breast cancer settings. This is an update of the review originally published in 2002 and subsequently updated in 2005 and 2012.
To assess the effects of bisphosphonates and other bone agents in addition to anti-cancer treatment: (i) in women with early breast cancer (EBC); (ii) in women with advanced breast cancer without bone metastases (ABC); and (iii) in women with metastatic breast cancer and bone metastases (BCBM).
In this review update, we searched Cochrane Breast Cancer's Specialised Register, CENTRAL, MEDLINE, Embase, the World Health Organization's International Clinical Trials Registry Platform (WHO ICTRP) and ClinicalTrials.gov on 19 September 2016.
We included randomised controlled trials (RCTs) comparing: (a) one treatment with a bisphosphonate/bone-acting agent with the same treatment without a bisphosphonate/bone-acting agent; (b) treatment with one bisphosphonate versus treatment with a different bisphosphonate; (c) treatment with a bisphosphonate versus another bone-acting agent of a different mechanism of action (e.g. denosumab); and (d) immediate treatment with a bisphosphonate/bone-acting agent versus delayed treatment of the same bisphosphonate/bone-acting agent.
Two review authors independently extracted data, and assessed risk of bias and quality of the evidence. The primary outcome measure was bone metastases for EBC and ABC, and a skeletal-related event (SRE) for BCBM. We derived risk ratios (RRs) for dichotomous outcomes and the meta-analyses used random-effects models. Secondary outcomes included overall survival and disease-free survival for EBC; we derived hazard ratios (HRs) for these time-to-event outcomes where possible. We collected toxicity and quality-of-life information. GRADE was used to assess the quality of evidence for the most important outcomes in each treatment setting.
We included 44 RCTs involving 37,302 women. In women with EBC, bisphosphonates were associated with a reduced risk of bone metastases compared to placebo/no bisphosphonate (RR 0.86, 95% confidence interval (CI) 0.75 to 0.99; P = 0.03, 11 studies; 15,005 women; moderate-quality evidence with no significant heterogeneity). Bisphosphonates provided an overall survival benefit with time-to-event data (HR 0.91, 95% CI 0.83 to 0.99; P = 0.04; 9 studies; 13,949 women; high-quality evidence with evidence of heterogeneity). Subgroup analysis by menopausal status showed a survival benefit from bisphosphonates in postmenopausal women (HR 0.77, 95% CI 0.66 to 0.90; P = 0.001; 4 studies; 6048 women; high-quality evidence with no evidence of heterogeneity) but no survival benefit for premenopausal women (HR 1.03, 95% CI 0.86 to 1.22; P = 0.78; 2 studies; 3501 women; high-quality evidence with no heterogeneity). There was evidence of no effect of bisphosphonates on disease-free survival (HR 0.94, 95% 0.87 to 1.02; P = 0.13; 7 studies; 12,578 women; high-quality evidence with significant heterogeneity present) however subgroup analyses showed a disease-free survival benefit from bisphosphonates in postmenopausal women only (HR 0.82, 95% CI 0.74 to 0.91; P < 0.001; 7 studies; 8314 women; high-quality evidence with no heterogeneity). Bisphosphonates did not significantly reduce the incidence of fractures when compared to placebo/no bisphosphonates (RR 0.77, 95% CI 0.54 to 1.08, P = 0.13, 6 studies, 7602 women; moderate-quality evidence due to wide confidence intervals). We await mature overall survival and disease-free survival results for denosumab trials. In women with ABC without clinically evident bone metastases, there was no evidence of an effect of bisphosphonates on bone metastases (RR 0.96, 95% CI 0.65 to 1.43; P = 0.86; 3 studies; 330 women; moderate-quality evidence with no heterogeneity) or overall survival (RR 0.89, 95% CI 0.73 to 1.09; P = 0.28; 3 studies; 330 women; high-quality evidence with no heterogeneity) compared to placebo/no bisphosphonates however the confidence intervals were wide. One study reported a trend towards an extended period of time without a SRE with bisphosphonate compared to placebo (low-quality evidence). One study reported quality of life and there was no apparent difference in scores between bisphosphonate and placebo (moderate-quality evidence). In women with BCBM, bisphosphonates reduced the SRE risk by 14% (RR 0.86, 95% CI 0.78 to 0.95; P = 0.003; 9 studies; 2810 women; high-quality evidence with evidence of heterogeneity) compared with placebo/no bisphosphonates. This benefit persisted when administering either intravenous or oral bisphosphonates versus placebo. Bisphosphonates delayed the median time to a SRE with a median ratio of 1.43 (95% CI 1.29 to 1.58; P < 0.00001; 9 studies; 2891 women; high-quality evidence with no heterogeneity) and reduced bone pain (in 6 out of 11 studies; moderate-quality evidence) compared to placebo/no bisphosphonate. Treatment with bisphosphonates did not appear to affect overall survival (RR 1.01, 95% CI 0.91 to 1.11; P = 0.85; 7 studies; 1935 women; moderate-quality evidence with significant heterogeneity). Quality-of-life scores were slightly better with bisphosphonates than placebo at comparable time points (in three out of five studies; moderate-quality evidence) however scores decreased during the course of the studies. Denosumab reduced the risk of developing a SRE compared with bisphosphonates by 22% (RR 0.78, 0.72 to 0.85; P < 0.001; 3 studies, 2345 women). One study reported data on overall survival and observed no difference in survival between denosumab and bisphosphonate. Reported toxicities across all settings were generally mild. Osteonecrosis of the jaw was rare, occurring less than 0.5% in the adjuvant setting (high-quality evidence).
For women with EBC, bisphosphonates reduce the risk of bone metastases and provide an overall survival benefit compared to placebo or no bisphosphonates. There is preliminary evidence suggestive that bisphosphonates provide an overall survival and disease-free survival benefit in postmenopausal women only when compared to placebo or no bisphosphonate. This was not a planned subgroup for these early trials, and we await the completion of new large clinical trials assessing benefit for postmenopausal women. For women with BCBM, bisphosphonates reduce the risk of developing SREs, delay the median time to an SRE, and appear to reduce bone pain compared to placebo or no bisphosphonate.","Exercise, dietary changes and medications are frequently used in the management of type 2 diabetes. However, it is difficult to determine the independent effect of exercise from some trials because exercise has been combined with dietary modifications or medications, or compared with a control which includes another form of intervention. The review authors aimed to determine the effect of exercise on blood sugar control in type 2 diabetes. This review found that exercise improves blood sugar control and that this effect is evident even without weight loss. Furthermore, exercise decreases body fat content, thus the failure to lose weight with exercise programmes is probably explained by the conversion of fat to muscle. Exercise improved the body's reaction to insulin and decreased blood lipids. Quality of life was only assessed in one study, which found no difference between the two groups. No significant difference was found between groups in blood levels of cholesterol or blood pressure. A total of 14 randomised controlled trials were assessed. These included 377 participants and compared groups that differed only with respect to an exercise programme intervention. The duration of the interventions in the studies ranged from eight weeks to one year. Two studies reported follow-up information, one at six months after the end of the six month exercise intervention and one at twelve months post-intervention. Generally, the studies were well-conducted, but blinding of outcome assessors was not reported and although all studies reported that randomisation was performed, few gave details of the method.No adverse effects with exercise were reported. The effect of exercise on diabetic complications was not assessed in any of the studies. The relatively short duration of trials prevented the reporting of any significant long term complications or mortality. Another limitation was the small number of participants included in the analyses for adiposity, blood pressure, cholesterol, body's muscle and quality of life.",1003
